{
  "$schema": "https://json-schema.org/draft/2020-12/schema",
  "$id": "https://execution-contracts.local/email/job-application-email-facts.v2.schema.json",
  "title": "Job application email facts v2",
  "description": "Additive provider-neutral successor to job-application-email-facts.v1. The source provider is the exact lowercase provider code emitted by the mailbox adapter (for example gmail_gog or apple_mail_emlx), never a fabricated Gmail label. All facts remain untrusted, least-data, proposal/correlation-only evidence. JobTrack code-side validation additionally enforces fromDomain equality and the event/interview cross-field rules documented in CONVENTIONS.md.",
  "type": "object",
  "additionalProperties": false,
  "required": [
    "schemaVersion",
    "trust",
    "source",
    "contentCompleteness",
    "eventKind",
    "postingRefs",
    "applicationRefs",
    "replyRequested",
    "evidence",
    "extraction",
    "security"
  ],
  "properties": {
    "schemaVersion": {
      "const": "job-application-email-facts.v2"
    },
    "trust": {
      "const": "untrusted_external"
    },
    "source": {
      "type": "object",
      "additionalProperties": false,
      "required": [
        "provider",
        "accountId",
        "messageId",
        "threadId",
        "receivedAt",
        "fromAddress",
        "fromDomain",
        "contentDigest"
      ],
      "properties": {
        "provider": {
          "type": "string",
          "pattern": "^[a-z][a-z0-9._-]{0,79}$"
        },
        "accountId": {
          "type": "string",
          "minLength": 1,
          "maxLength": 320
        },
        "messageId": {
          "type": "string",
          "minLength": 1,
          "maxLength": 500
        },
        "threadId": {
          "type": "string",
          "minLength": 1,
          "maxLength": 500
        },
        "receivedAt": {
          "type": "string",
          "format": "date-time"
        },
        "fromAddress": {
          "type": "string",
          "format": "email",
          "maxLength": 320
        },
        "fromDomain": {
          "type": "string",
          "minLength": 1,
          "maxLength": 253
        },
        "fromDisplayName": {
          "type": "string",
          "minLength": 1,
          "maxLength": 998
        },
        "replyToAddress": {
          "type": "string",
          "format": "email",
          "maxLength": 320
        },
        "contentDigest": {
          "$ref": "#/$defs/sha256"
        }
      }
    },
    "contentCompleteness": {
      "enum": [
        "metadata_only",
        "sanitized_plain_text"
      ]
    },
    "eventKind": {
      "enum": [
        "application_received",
        "action_required",
        "interview_invite",
        "interview_rescheduled",
        "interview_cancelled",
        "rejection",
        "offer",
        "withdrawal_confirmed",
        "recruiter_followup",
        "unknown"
      ]
    },
    "company": {
      "type": "object",
      "additionalProperties": false,
      "properties": {
        "name": {
          "type": "string",
          "minLength": 1,
          "maxLength": 300
        },
        "domain": {
          "type": "string",
          "minLength": 1,
          "maxLength": 253
        }
      },
      "anyOf": [
        {
          "required": [
            "name"
          ]
        },
        {
          "required": [
            "domain"
          ]
        }
      ]
    },
    "postingRefs": {
      "type": "array",
      "maxItems": 20,
      "items": {
        "type": "object",
        "additionalProperties": false,
        "properties": {
          "url": {
            "type": "string",
            "format": "uri",
            "pattern": "^https?://",
            "maxLength": 2000
          },
          "provider": {
            "type": "string",
            "minLength": 1,
            "maxLength": 100
          },
          "externalJobId": {
            "type": "string",
            "minLength": 1,
            "maxLength": 300
          },
          "roleTitle": {
            "type": "string",
            "minLength": 1,
            "maxLength": 500
          }
        },
        "anyOf": [
          {
            "required": [
              "url"
            ]
          },
          {
            "required": [
              "externalJobId"
            ]
          },
          {
            "required": [
              "roleTitle"
            ]
          }
        ]
      }
    },
    "applicationRefs": {
      "type": "array",
      "maxItems": 20,
      "items": {
        "type": "object",
        "additionalProperties": false,
        "required": [
          "namespace",
          "value"
        ],
        "properties": {
          "namespace": {
            "type": "string",
            "minLength": 1,
            "maxLength": 100
          },
          "value": {
            "type": "string",
            "minLength": 1,
            "maxLength": 500
          }
        }
      }
    },
    "interview": {
      "type": "object",
      "additionalProperties": false,
      "required": [
        "intent"
      ],
      "properties": {
        "intent": {
          "enum": [
            "schedule",
            "reschedule",
            "cancel",
            "reminder",
            "outcome",
            "unknown"
          ]
        },
        "round": {
          "enum": [
            "screen",
            "technical",
            "onsite",
            "final",
            "other"
          ]
        },
        "scheduledAt": {
          "type": "string",
          "format": "date-time"
        },
        "previousScheduledAt": {
          "type": "string",
          "format": "date-time"
        },
        "timezone": {
          "type": "string",
          "minLength": 1,
          "maxLength": 100
        },
        "format": {
          "enum": [
            "phone",
            "video",
            "onsite",
            "unknown"
          ]
        },
        "interviewer": {
          "type": "string",
          "minLength": 1,
          "maxLength": 500
        }
      }
    },
    "requestedAction": {
      "type": "object",
      "additionalProperties": false,
      "required": [
        "kind"
      ],
      "properties": {
        "kind": {
          "enum": [
            "reply",
            "schedule",
            "complete_assessment",
            "provide_information",
            "review_offer",
            "other"
          ]
        },
        "deadline": {
          "type": "string",
          "format": "date-time"
        }
      }
    },
    "replyRequested": {
      "type": "boolean"
    },
    "evidence": {
      "type": "array",
      "maxItems": 20,
      "items": {
        "type": "object",
        "additionalProperties": false,
        "required": [
          "field",
          "excerpt"
        ],
        "properties": {
          "field": {
            "enum": [
              "from",
              "subject",
              "body",
              "url",
              "header"
            ]
          },
          "excerpt": {
            "type": "string",
            "minLength": 1,
            "maxLength": 500
          }
        }
      }
    },
    "extraction": {
      "type": "object",
      "additionalProperties": false,
      "required": [
        "provider",
        "version",
        "confidence"
      ],
      "properties": {
        "provider": {
          "type": "string",
          "minLength": 1,
          "maxLength": 100
        },
        "model": {
          "type": "string",
          "minLength": 1,
          "maxLength": 200
        },
        "version": {
          "type": "string",
          "minLength": 1,
          "maxLength": 100
        },
        "confidence": {
          "type": "number",
          "minimum": 0,
          "maximum": 1
        }
      }
    },
    "security": {
      "type": "object",
      "additionalProperties": false,
      "required": [
        "risk",
        "requiresReview"
      ],
      "properties": {
        "risk": {
          "enum": [
            "low",
            "medium",
            "high"
          ]
        },
        "requiresReview": {
          "type": "boolean"
        }
      }
    }
  },
  "$defs": {
    "sha256": {
      "type": "string",
      "pattern": "^[a-f0-9]{64}$"
    }
  }
}
